Product Name,Price
Top Luxury Brand Watch Famous Fashion Sports Cool Men Quartz Watches Waterproof Wristwatch For Male NF9156,"KSh 1,999 "
 268 Fashion Simple Style Business Men Wrist Watch Leather Quartz Watch,KSh 599 
 268 Fashion Simple Style Business Men Wrist Watch Leather Quartz Watch,KSh 799 
Brand Watch Famous Fashion Sports Cool Men Quartz Watches Waterproof Wristwatch For Male NF9156,"KSh 1,999 "
Top Luxury Brand Watch Famous Fashion Sports Cool Men Quartz Watches Waterproof Wristwatch For Male NF9156,"KSh 1,999 "
Top Luxury Brand Watch Famous Fashion Sports Cool Men Quartz Watches Waterproof Wristwatch For Male NF9156,"KSh 1,999 "
 268 Fashion Simple Style Business Men Wrist Watch Leather Quartz Watch,KSh 799 
Exquisite Round Dial Casual Elegant Man Luxury Analog Quartz Wristwatch - Brown,KSh 192 
Men Analog Watch Stainless Steel Band Alloy Case Wristwatch - Silver,KSh 286 
Luxury Diamond Watch Men Watch Calendar Display Quartz Wristwatches,KSh 799 
5Colors Electronic Analog Wrist Watch Round Nylon Strap Military Wristwatch,KSh 225 
TA-Spider Cartoon Watch Kids Analog Quartz Wrist Watch Rubber Band Wristwatch*,KSh 198 
Vintage Stainless Steel Watch with Calendar,"KSh 1,449 "
TA-Geneva Bling Crystal Women Girl Unisex Stainless Steel Quartz Wrist Watch*,KSh 488 
Men Sports Watches Watch Alarm Chronograph Digital Wristwatches Waterproof,KSh 598 
Mens Watches Fashion Hollow Casual  Leather Strap Men Quartz Watch,KSh 388 
TA-Universal Casual Stylish Numerals PU Leather Alloy Quartz Watch Accessory*Pink,KSh 247 
2 In 1 XINEW Luxury Men's Calendar Watch+Free Hiphop Bracelet Set,"KSh 1,699 "
Fashion Design Male Wristwatch Stainless Steel Sports Quartz Watches,KSh 415 
Men Stainless Steel Waterproof Calendar Quartz Watch Business Casual Gold,"KSh 1,069 "
Vintage Classic Men's Waterproof Date Leather Strap Sport Quartz Army Watch,KSh 694 
Silver 1381 Men Analog Digital Watch,KSh 888 
Luxury Mens Sports Watches Dive 50m Digital LED Military Watch Men Fashion Casual Electronics Wristwatches,KSh 820 
Digital Smart Sport Watch for Men with Pedometer,"KSh 1,599 "
Luxury Mens' Sport Leather Wristwatch - Dark Brown,"KSh 1,480 "
LED Watch Digital Silicone Running Bracelet For Women Men Kids,KSh 85 
Men's Black Wrist Watch Retro Style,KSh 729 
Men Leather Strap Quartz Sports Casual Formal Watches-Brown,KSh 799 
Yazole Africashop Watch  2PC Luxury Fashion Faux Leather Mens Blue Ray Glass Quartz Analog Watches-Black,KSh 850 
Mens Watches +Bracelets Set Diamond Iced Out Cuban Chain Gold Luxury Watch Set,"KSh 1,488 "
Top Luxury Brand Watch Fashion Sports Cool Men Quartz Watches Stainless Steel Wristwatch For Male,"KSh 1,368 "
NAVIFORCE Luxury Brand Men Stainless Steel Gold Watch Men's Quartz Clock Man Sports Waterproof Wrist Watches relogio masculino - gold,"KSh 1,580 "
TA-Universal Casual Stylish Numerals PU Leather Alloy Quartz Watch Accessory*Red,KSh 254 
Silicone Rubber LED Bracelet Touch Digital Wrist Watch Electronic Stylish Cool Black,KSh 376 
Top Luxury Brand Watch Famous Fashion Sports Cool Men Quartz Watches Waterproof Wristwatch For Male NF9074,"KSh 1,334 "
"Men's Quartz Wrist Watch, Stainless Steel Band - Silver Blue","KSh 1,599 "
Couple watch luminous waterproof steel belt watch-blue,KSh 719 
TA-Geneva Bling Crystal Women Girl Unisex Stainless Steel Quartz Wrist Watch*,KSh 497 
Classic Business Men Watches Quartz Male Watch 3ATM Water-resistant Luminous Man Watch Time Display,KSh 539 
NEW M2 Smart Band Heart Rate Monitor Fitness Tracker Smart Watch Women Men Kids Waterproof Wearable Device for IOS Android Phone Strap Black,KSh 698 
